Quest Requirements;Item Requiremenets;Conversation ID;Dialogue;Repeat Requirements;Triggers
~;~;#Kai;What the fuck?! These people are crazy!;~;~
~;~;#Kai;I wandered into a damn cult! They wanted me to do a ritual but they left out the part where the ritual requires them to tear out my damn eyes!;~;~
~;~;#Kai;They seemed so enlightened. I was wondering how they saw differently. What was I thinking? I thought they just practiced meditation, hell even yoga! ;~;~
~;~;#Kai;Nope. Just rip your eyes out! They want to abandon this world and let the darkness swallow everything. Let this world die and bring in the next one, huh? What a bunch of morons.;~;~
~;~;#Kai;Not sure how long I can hide here. May only be a matter of time before they come.;~;~
